{
  "$schema": "http://json-schema.org/draft-07/schema#",
  "type": "object",
  "properties": {
    "$schema": {
      "type": "string",
      "pattern": "^\\.\\./.+\\.schema\\.json$"
    },
    "name": {
      "type": "string",
      "minLength": 1
    },
    "logoURI": {
      "type": "string",
      "pattern": "^(https://imagedelivery\\.net/qNj7Q3MCke89zoKzav7eDQ/(tokens/(default|0x[0-9a-f]{40})\\.(png|jpg|jpeg)|validators/0x[0-9a-f]{96}\\.(png|jpg|jpeg)|vaults/0x[0-9a-f]{40}\\.(png|jpg|jpeg)|protocols/[a-z0-9-]+\\.(png|jpg|jpeg))/public)$"
    },
    "tags": {
      "type": "object",
      "additionalProperties": {
        "type": "object",
        "properties": {
          "name": {
            "type": "string",
            "minLength": 1
          },
          "description": {
            "type": "string",
            "minLength": 1
          }
        },
        "required": ["name", "description"],
        "additionalProperties": false
      }
    },
    "tokens": {
      "type": "array",
      "items": {
        "type": "object",
        "properties": {
          "address": {
            "type": "string",
            "pattern": "^0x[a-fA-F0-9]{40}$"
          },
          "chainId": {
            "type": "integer"
          },
          "name": {
            "type": "string"
          },
          "symbol": {
            "type": "string"
          },
          "decimals": {
            "type": "integer"
          },
          "logoURI": {
            "type": "string",
            "pattern": "^(https://imagedelivery\\.net/qNj7Q3MCke89zoKzav7eDQ/(tokens/(default|0x[0-9a-f]{40})\\.(png|jpg|jpeg)|validators/0x[0-9a-f]{96}\\.(png|jpg|jpeg)|vaults/0x[0-9a-f]{40}\\.(png|jpg|jpeg)|protocols/[a-z0-9-]+\\.(png|jpg|jpeg))/public)$"
          },
          "base64": {
            "type": "string"
          },
          "tags": {
            "type": "array",
            "items": {
              "type": "string"
            }
          }
        },
        "required": ["address", "chainId", "name", "symbol", "decimals"]
      },
      "minItems": 1
    }
  },
  "required": ["name", "logoURI", "tags", "tokens", "$schema"],
  "additionalProperties": false
}
